{
  "envelope_version": "0.1",
  "subject": {
    "type": "column",
    "id": "col_email",
    "name": "email"
  },
  "inference_permitted": true,
  "governance_notice": "AI-generated content is unverified and not certified.",
  "certified_findings": [
    {
      "id": "cf-1",
      "rule_id": "DQ-17",
      "certified_by": "steward_a",
      "certified_at": "2026-09-20T00:00:00Z"
    }
  ],
  "profiling_observations": [
    {
      "id": "po-1",
      "observed_at": "2026-09-20T00:00:00Z",
      "profile_run_id": "pr_9"
    }
  ],
  "ai_inferences": [
    {
      "id": "ai-1",
      "model": "provider/model-id",
      "generated_at": "2026-09-20T00:00:00Z"
    }
  ],
  "curated_metadata": [
    {
      "id": "cm-1",
      "authored_by": "steward_a",
      "authored_at": "2026-09-20T00:00:00Z"
    }
  ]
}
